Question	Answer
"Vivo em Portugal e sou português. A timezone na planilha Google Sheets para minha conta Google mostra +01:00. É assim que eu coloco na planilha?"	"No seu caso, vai ser: Parameters
=+0100 (na linha 6, coluna A em vermelho)."
"Como sou português e resido em Portugal, a planilha Google Sheets tem a timezone para minha conta Google, que aparece como +01:00. É assim que eu insiro na planilha?"	"Para você, ficará: Parameters
=+0100 (na linha 6, coluna A em vermelho)."
"Sou português vivendo em Portugal e a planilha Google Sheets indica o fuso horário +01:00 para a minha conta Google. Devo colocar assim na planilha?"	"Para você, deve ser: Parameters
=+0100 (na linha 6, coluna A em vermelho)."
"Sou de Portugal e na planilha Google Sheets, o fuso horário para minha conta Google é +01:00. É assim que coloco na planilha, certo?"	"No seu caso, deve ficar: Parameters
=+0100 (na linha 6, coluna A em vermelho)."
"Como português vivendo em Portugal, a planilha Google Sheets precisa do fuso horário, que aparece como +01:00 para minha conta Google. É assim que coloco na planilha?"	"Para você, ficará: Parameters
=+0100 (na linha 6, coluna A em vermelho)."
"Sou português e resido em Portugal. A planilha Google Sheets apresenta o fuso horário como +01:00 para minha conta Google. É assim que eu coloco na planilha?"	"No seu caso, vai ser: Parameters
=+0100 (na linha 6, coluna A em vermelho)."
"Sou de Portugal e, na planilha Google Sheets, o fuso horário para minha conta Google é +01:00. Coloco assim na planilha, certo?"	"Para você, ficará: Parameters
=+0100 (na linha 6, coluna A em vermelho)."
"Vivo em Portugal e sou português. A timezone na planilha Google Sheets para minha conta Google aparece como +01:00. Devo inserir assim na planilha?"	"No seu caso, deve ser: Parameters
=+0100 (na linha 6, coluna A em vermelho)."
"Como português que vive em Portugal, a planilha Google Sheets exige a timezone para minha conta Google, que aparece como +01:00. É assim que coloco na planilha?"	"Para você, ficará: Parameters
=+0100 (na linha 6, coluna A em vermelho)."
"Sou português e moro em Portugal. A planilha Google Sheets requer que eu insira o fuso horário +01:00 na minha conta Google. É assim que eu faço na planilha?"	"No seu caso, vai ser: Parameters
=+0100 (na linha 6, coluna A em vermelho)."
"Vivo em Portugal e sou de lá. A planilha Google Sheets mostra o fuso horário +01:00 para a minha conta Google. Coloco assim na planilha, certo?"	"Para você, deve ficar: Parameters
=+0100 (na linha 6, coluna A em vermelho)."
"Como sou português e vivo em Portugal, a planilha Google Sheets tem o fuso horário para a minha conta Google, que aparece como +01:00. É assim que coloco na planilha?"	"Para você, ficará: Parameters
=+0100 (na linha 6, coluna A em vermelho)."
"Sou de Portugal e, na planilha Google Sheets, o fuso horário para minha conta Google é +01:00. Coloco assim na planilha, correto?"	"No seu caso, será: Parameters
=+0100 (na linha 6, coluna A em vermelho)."
"Sou português vivendo em Portugal. A planilha Google Sheets tem a timezone para a minha conta Google, que mostra +01:00. É assim que coloco na planilha?"	"Para você, deve ser: Parameters
=+0100 (na linha 6, coluna A em vermelho)."
"Como sou de Portugal e moro aqui, a planilha Google Sheets mostra o fuso horário +01:00 para minha conta Google. É assim que eu coloco na planilha?"	"No seu caso, ficará: Parameters
=+0100 (na linha 6, coluna A em vermelho)."
"Vivo em Portugal e sou português. A timezone na planilha Google Sheets aparece como +01:00 para minha conta Google. É assim que eu coloco na planilha, certo?"	"Para você, será: Parameters
=+0100 (na linha 6, coluna A em vermelho)."
"Minha chave instalada estava em um domínio que expirou, e a hospedagem também venceu. Para renovar, o custo está muito mais alto. Eu contratei outra hospedagem, mas a chave diz que está instalada em outro domínio. Como posso resolver isso?"	"Por favor, envie seus dados para que possamos verificar."
"A chave que instalei estava em um domínio que já venceu, assim como a hospedagem. A renovação está muito cara. Mudei para outra hospedagem, mas a chave mostra que está instalada em outro domínio. O que eu faço?"	"Por favor, forneça seus dados e iremos verificar."
"Minha chave estava em um domínio que expirou, assim como a hospedagem. Agora, a renovação está muito mais cara. Eu contratei outra hospedagem, mas a chave indica que está em outro domínio. Como resolver isso?"	"Por favor, envie suas informações para que possamos verificar."
"A chave instalada estava em um domínio que venceu e a hospedagem também. Para renovar está muito caro, então aderi a outra hospedagem. A chave, no entanto, diz que está em outro domínio. Como posso solucionar isso?"	"Por favor, passe seus dados que iremos verificar."
"A chave que estava instalada estava em um domínio que venceu, e a hospedagem também. O custo para renovar está muito alto. Agora estou em outra hospedagem, mas a chave está vinculada a outro domínio. O que posso fazer?"	"Por favor, forneça suas informações para que possamos verificar."
"Minha chave instalada pertencia a um domínio que já expirou e a hospedagem também. Agora, para renovar, está muito caro. Mudei para outra hospedagem, mas a chave diz que está instalada em outro domínio. Como posso resolver isso?"	"Por favor, envie seus dados para que possamos ajudar."
"Minha chave estava instalada em um domínio que venceu, assim como a hospedagem. A renovação está muito cara, então eu mudei para outra hospedagem, mas a chave mostra que está em outro domínio. O que fazer?"	"Por favor, passe suas informações para que possamos verificar."
"Minha chave estava em um domínio que expirou, e a hospedagem também venceu. Agora, a renovação está muito mais cara. Comecei outra hospedagem, mas a chave indica que está instalada em outro domínio. Como resolver isso?"	"Por favor, forneça seus dados para que possamos ajudar."
"A chave que instalei estava em um domínio que já venceu e a hospedagem também. O custo para renovar está alto. Eu contratei outra hospedagem, mas a chave diz que está vinculada a outro domínio. O que posso fazer?"	"Por favor, envie suas informações e iremos verificar."
"Minha chave estava em um domínio que expirou e a hospedagem também. Agora, a renovação está muito cara. Aderi a outra hospedagem, mas a chave mostra que está instalada em outro domínio. Como posso resolver isso?"	"Por favor, passe seus dados que iremos verificar."
"A chave instalada estava em um domínio que venceu, assim como a hospedagem. Agora, a renovação custa muito. Eu peguei outra hospedagem, mas a chave diz que está em outro domínio. O que eu faço?"	"Por favor, forneça seus dados e iremos verificar."
"Minha chave estava vinculada a um domínio que expirou, assim como a hospedagem. O custo para renovar é muito alto. Mudei para outra hospedagem, mas a chave indica que está em outro domínio. Como posso resolver isso?"	"Por favor, envie suas informações para que possamos ajudar."
"A chave que instalei estava em um domínio que já venceu, e a hospedagem também expirou. Para renovar está muito caro, então peguei outra hospedagem, mas a chave mostra que está instalada em outro domínio. O que fazer?"	"Por favor, passe seus dados para que possamos verificar."
"A chave que tinha instalada estava em um domínio que expirou e a hospedagem também. O custo da renovação está muito alto. Comecei outra hospedagem, mas a chave diz que está em outro domínio. Como posso resolver isso?"	"Por favor, forneça suas informações e iremos verificar."
"Minha chave estava em um domínio que venceu, assim como a hospedagem. A renovação custa muito caro, então contratei outra hospedagem, mas a chave diz que está vinculada a outro domínio. O que eu faço?"	"Por favor, envie seus dados para que possamos ajudar."
"A chave que instalei estava em um domínio expirado e a hospedagem também venceu. Para renovar está muito caro, então mudei para outra hospedagem. A chave diz que está instalada em outro domínio. Como resolver isso?"	"Por favor, passe suas informações e iremos verificar."
"Sou usuário de uma chave que estava em um domínio que venceu, e a hospedagem também expirou. O custo para renovar é muito alto, então peguei outra hospedagem. A chave diz que está em outro domínio. Como posso resolver isso?"	"Por favor, forneça seus dados para que possamos ajudar."
"Minha chave instalada estava vinculada a um domínio que expirou, assim como a hospedagem. Agora, a renovação está muito cara. Aderi a outra hospedagem, mas a chave diz que está em outro domínio. O que fazer?"	"Por favor, envie suas informações e iremos verificar."
"Minha chave estava em um domínio que venceu, e a hospedagem também expirou. Para renovar, o custo está alto. Eu contratei outra hospedagem, mas a chave mostra que está em outro domínio. Como posso resolver isso?"	"Por favor, passe seus dados que iremos verificar."
"A chave que tenho estava em um domínio expirado, e a hospedagem também venceu. O custo para renovação está alto. Mudei para outra hospedagem, mas a chave indica que está em outro domínio. O que eu faço?"	"Por favor, forneça suas informações para que possamos ajudar."
"É possível pegar o gclid no relatório do super pressel também?"	"Sim, o gclid está disponível lá."
"Posso encontrar o gclid no relatório do super pressel?"	"Sim, o gclid pode ser encontrado lá."
"Consegue pegar o gclid no relatório do super pressel também?"	"Sim, o gclid está disponível lá."
"O gclid pode ser obtido no relatório do super pressel?"	"Sim, o gclid está disponível lá."
"Tem como acessar o gclid pelo relatório do super pressel?"	"Sim, o gclid está lá para você."
"Eu consigo pegar o gclid no relatório do super pressel?"	"Sim, o gclid está lá disponível."
"O gclid está acessível no relatório do super pressel?"	"Sim, você encontra o gclid lá."
"É viável obter o gclid no relatório do super pressel?"	"Sim, o gclid está disponível lá."
"Posso pegar o gclid diretamente do relatório do super pressel?"	"Sim, o gclid está lá para você."
"O relatório do super pressel contém o gclid?"	"Sim, o gclid está disponível lá."
"Da para acessar o gclid pelo relatório do super pressel?"	"Sim, você encontra o gclid lá."
"É possível encontrar o gclid no relatório do super pressel?"	"Sim, o gclid está disponível lá."
"Eu consigo acessar o gclid no relatório do super pressel?"	"Sim, o gclid pode ser encontrado lá."
"O gclid pode ser retirado do relatório do super pressel?"	"Sim, está disponível lá."
"É possível obter o gclid no relatório do super pressel?"	"Sim, você encontra o gclid lá."
"Consegue pegar o gclid no relatório do super pressel?"	"Sim, o gclid está lá para você."
"Eu posso encontrar o gclid no relatório do super pressel?"	"Sim, o gclid está lá."
"Da pra acessar o gclid no relatório do super pressel?"	"Sim, o gclid está disponível lá."
"É viável obter o gclid através do relatório do super pressel?"	"Sim, o gclid está lá."
"Tem como pegar o gclid no relatório do super pressel?"	"Sim, o gclid está disponível lá."
"Para atualizar o Smart Click, preciso desinstalá-lo como ensinado no módulo (Desinstalando corretamente o seu Smart Click)?"	"Não, você pode atualizar diretamente pelo WordPress na seção de plugins."
"Preciso desinstalar o Smart Click para fazer a atualização conforme o módulo (Desinstalando corretamente o seu Smart Click)?"	"Não, a atualização pode ser feita diretamente no WordPress na parte de plugins."
"Para atualizar o Smart Click, devo desinstalá-lo como indicado no módulo (Desinstalando corretamente o seu Smart Click)?"	"Não, você pode realizar a atualização diretamente no WordPress na área de plugins."
"É necessário desinstalar o Smart Click para atualizá-lo, conforme ensinado no módulo (Desinstalando corretamente o seu Smart Click)?"	"Não, você pode atualizar diretamente na seção de plugins do WordPress."
"Para atualizar o Smart Click, é preciso desinstalá-lo como ensinado no módulo (Desinstalando corretamente o seu Smart Click)?"	"Não, a atualização é possível diretamente do WordPress na parte de plugins."
"Eu tenho que desinstalar o Smart Click para atualizá-lo, como está no módulo (Desinstalando corretamente o seu Smart Click)?"	"Não, você pode fazer a atualização diretamente na área de plugins do WordPress."
"Para atualizar o Smart Click, é necessário desinstalá-lo seguindo o que está no módulo (Desinstalando corretamente o seu Smart Click)?"	"Não, você pode atualizar diretamente pela seção de plugins no WordPress."
"Preciso desinstalar o Smart Click para fazer a atualização conforme indicado no módulo (Desinstalando corretamente o seu Smart Click)?"	"Não, você pode atualizar diretamente do WordPress na parte de plugins."
"Para atualizar o Smart Click, devo desinstalá-lo conforme é ensinado no módulo (Desinstalando corretamente o seu Smart Click)?"	"Não, você consegue atualizar diretamente no WordPress na área de plugins."
"É preciso desinstalar o Smart Click para atualizá-lo, de acordo com o que está no módulo (Desinstalando corretamente o seu Smart Click)?"	"Não, a atualização pode ser feita diretamente na seção de plugins do WordPress."
"Para fazer a atualização do Smart Click, é necessário desinstalá-lo seguindo o módulo (Desinstalando corretamente o seu Smart Click)?"	"Não, você pode atualizar diretamente do WordPress na parte de plugins."
"Devo desinstalar o Smart Click para atualizá-lo, como indicado no módulo (Desinstalando corretamente o seu Smart Click)?"	"Não, você pode fazer a atualização diretamente na área de plugins do WordPress."
"É necessário desinstalar o Smart Click para conseguir atualizá-lo, conforme ensina o módulo (Desinstalando corretamente o seu Smart Click)?"	"Não, você pode realizar a atualização diretamente na seção de plugins do WordPress."
"Para atualizar o Smart Click, tenho que desinstalá-lo como diz o módulo (Desinstalando corretamente o seu Smart Click)?"	"Não, você pode atualizar diretamente do WordPress na parte de plugins."
"Para realizar a atualização do Smart Click, preciso desinstalá-lo seguindo o que está no módulo (Desinstalando corretamente o seu Smart Click)?"	"Não, você consegue atualizar diretamente pela seção de plugins no WordPress."
"É preciso desinstalar o Smart Click para fazer a atualização, conforme ensinado no módulo (Desinstalando corretamente o seu Smart Click)?"	"Não, a atualização é possível diretamente no WordPress na parte de plugins."
"Eu preciso desinstalar o Smart Click para atualizá-lo, como indicado no módulo (Desinstalando corretamente o seu Smart Click)?"	"Não, você pode atualizar diretamente na área de plugins do WordPress."
"Para atualizar o Smart Click, é necessário desinstalá-lo seguindo as instruções do módulo (Desinstalando corretamente o seu Smart Click)?"	"Não, você pode realizar a atualização diretamente na seção de plugins do WordPress."
"Preciso desinstalar o Smart Click para realizar a atualização, como está no módulo (Desinstalando corretamente o seu Smart Click)?"	"Não, a atualização pode ser feita diretamente do WordPress na parte de plugins."
"Para atualizar o Smart Click, eu tenho que desinstalá-lo de acordo com o que ensina o módulo (Desinstalando corretamente o seu Smart Click)?"	"Não, você consegue atualizar diretamente pela seção de plugins do WordPress."
"Realizei o processo para remover a licença de um domínio e transferi-la para um subdomínio, mas estou enfrentando um erro. Quando insiro meu e-mail e o código da licença, não funciona. Você pode me ajudar? Já desativei o plugin e desinstalei, mas não resolveu."	"Por favor, desative a licença antes de desligar o Smart Click, isso deve resolver."
"Segui os passos para remover a licença de um domínio e transferi-la para um subdomínio, mas está dando erro. Ao colocar meu e-mail e o código da licença, não funciona. Você consegue me ajudar? Já desativei o plugin e desinstalei, mas não adiantou."	"Por favor, desative a licença antes de desativar o Smart Click que deve resolver."
"Fiz a remoção da licença de um domínio para usar em um subdomínio, mas ocorreu um erro. Quando coloco meu e-mail e o código, não consigo. Pode me ajudar? Já desinstalei e desativei o plugin, mas não funcionou."	"Por favor, desative a licença antes de desligar o Smart Click, isso deve funcionar."
"Completei o procedimento para transferir a licença de um domínio para um subdomínio, mas está apresentando erro. Ao inserir meu e-mail e o código da licença, não dá certo. Você pode ajudar? Já desativei o plugin e desinstalei, mas não resolveu."	"Por favor, desative a licença antes de desligar o Smart Click que deve funcionar."
"Realizei o processo para remover a licença de um domínio e levar para um subdomínio, mas está dando erro. Quando coloco meu e-mail e o código da licença, não acontece nada. Pode me ajudar? Já desinstalei e desativei o plugin, mas não funcionou."	"Por favor, desative a licença antes de desativar o Smart Click, isso deve resolver."
"Fiz a remoção da licença de um domínio para transferi-la a um subdomínio e encontrei um erro. Quando insiro meu e-mail e o código da licença, não está funcionando. Você consegue me ajudar? Já desinstalei e desativei o plugin, mas sem sucesso."	"Por favor, desative a licença antes de desligar o Smart Click que deve funcionar."
"Segui o procedimento para mover a licença de um domínio para um subdomínio, mas encontrei um erro. Ao inserir meu e-mail e o código da licença, não funcionou. Pode me ajudar? Já desativei o plugin e desinstalei, mas não deu certo."	"Por favor, desative a licença antes de desativar o Smart Click que deve funcionar."
"Fiz a troca da licença de um domínio para um subdomínio, mas estou tendo problemas. Quando coloco meu e-mail e o código da licença, não está funcionando. Você pode ajudar? Já desinstalei o plugin e desativei, mas não resolveu."	"Por favor, desative a licença antes de desligar o Smart Click, isso deve resolver."
"Completei o procedimento para remover a licença de um domínio e levá-la a um subdomínio, mas estou enfrentando um erro. Quando insiro meu e-mail e o código da licença, não dá certo. Você pode me ajudar? Já desinstalei e desativei o plugin, mas não funcionou."	"Por favor, desative a licença antes de desligar o Smart Click, isso deve funcionar."
"Fiz o procedimento para mover a licença de um domínio para um subdomínio, mas ocorreu um erro. Ao colocar meu e-mail e o código da licença, não está funcionando. Você pode me ajudar? Já desativei o plugin e desinstalei, mas não resolveu."	"Por favor, desative a licença antes de desligar o Smart Click, isso deve resolver."
"Eu realizei a remoção da licença de um domínio para transferi-la para um subdomínio, mas estou tendo um erro. Quando coloco meu e-mail e o código da licença, não funciona. Você pode ajudar? Já desinstalei e desativei o plugin, mas sem sucesso."	"Por favor, desative a licença antes de desativar o Smart Click que deve funcionar."
"Fiz a remoção da licença de um domínio para transferir para um subdomínio, mas está apresentando erro. Quando insiro meu e-mail e o código, não consigo. Você pode me ajudar? Já desinstalei e desativei o plugin, mas não adiantou."	"Por favor, desative a licença antes de desligar o Smart Click que deve funcionar."
"Segui o procedimento para remover a licença de um domínio para levar a um subdomínio, mas deu erro. Quando coloco meu e-mail e o código da licença, não vai. Você consegue me ajudar? Já desativei o plugin e desinstalei, mas não deu certo."	"Por favor, desative a licença antes de desativar o Smart Click, isso deve resolver."
"Fiz o processo de remoção da licença de um domínio para um subdomínio, mas estou enfrentando um erro. Quando coloco meu e-mail e o código da licença, não dá certo. Pode me ajudar? Já desinstalei e desativei o plugin, mas não funcionou."	"Por favor, desative a licença antes de desligar o Smart Click, isso deve funcionar."
"Realizei o procedimento de transferência da licença de um domínio para um subdomínio, mas estou tendo um erro. Quando coloco meu e-mail e o código, não acontece nada. Pode me ajudar? Já desativei o plugin e desinstalei, mas não resolveu."	"Por favor, desative a licença antes de desligar o Smart Click, isso deve funcionar."
"Fiz a troca da licença de um domínio para um subdomínio, mas está apresentando um erro. Ao inserir meu e-mail e o código da licença, não funciona. Você consegue me ajudar? Já desinstalei o plugin e desativei, mas não adiantou."	"Por favor, desative a licença antes de desativar o Smart Click que deve funcionar."
"Completei o procedimento de remoção da licença de um domínio para um subdomínio, mas estou enfrentando um erro. Quando coloco meu e-mail e o código da licença, não dá certo. Você pode ajudar? Já desinstalei e desativei o plugin, mas não funcionou."	"Por favor, desative a licença antes de desligar o Smart Click que deve funcionar."
"Fiz a remoção da licença de um domínio para um subdomínio, mas estou tendo problemas. Quando coloco meu e-mail e o código, não consigo. Pode me ajudar? Já desinstalei e desativei o plugin, mas não resolveu."	"Por favor, desative a licença antes de desligar o Smart Click que deve funcionar."
"Eu realizei o procedimento para mover a licença de um domínio para um subdomínio, mas deu erro. Quando insiro meu e-mail e o código da licença, não funciona. Você pode ajudar? Já desinstalei e desativei o plugin, mas não adiantou."	"Por favor, desative a licença antes de desativar o Smart Click que deve funcionar."
"Segui o procedimento de remoção da licença de um domínio para um subdomínio, mas estou enfrentando um erro. Ao colocar meu e-mail e o código da licença, não vai. Você consegue me ajudar? Já desinstalei e desativei o plugin, mas não deu certo."	"Por favor, desative a licença antes de desligar o Smart Click, isso deve resolver."
"Meus pixels estão com status inativo. Como posso deixá-los ativos?"	"Assim que você fizer vendas e subir as conversões, eles mudarão para ativo."
"Os meus pixels estão marcados como inativos. O que eu faço para ativá-los?"	"Depois que você realizar vendas e subir as conversões, eles ficarão ativos."
"Estou com os pixels inativos. Como posso ativá-los?"	"Assim que você tiver vendas e subir as conversões, o status mudará para ativo."
"Meus pixels estão inativos. O que devo fazer para torná-los ativos?"	"Assim que você fizer vendas e subir as conversões, eles se tornarão ativos."
"Os pixels que tenho estão com status inativo. Como posso deixá-los ativos?"	"Assim que você realizar vendas e enviar as conversões, eles mudarão para ativo."
"Estou vendo que meus pixels estão inativos. Como posso ativá-los?"	"Assim que você fizer vendas e atualizar as conversões, eles ficarão ativos."
"Meus pixels estão com status inativo. O que fazer para que fiquem ativos?"	"Quando você realizar vendas e subir as conversões, o status deles se tornará ativo."
"Os pixels estão inativos. O que eu faço para torná-los ativos?"	"Assim que você tiver vendas e subir as conversões, o status deles mudará para ativo."
"Meus pixels estão inativos. Como posso deixá-los ativos?"	"Depois de realizar vendas e subir as conversões, eles se tornarão ativos."
"Estou enfrentando o problema dos meus pixels estarem inativos. Como posso ativá-los?"	"Assim que você fizer vendas e atualizar as conversões, o status deles mudará para ativo."
"Os pixels que estou usando estão inativos. Como faço para que eles fiquem ativos?"	"Assim que você realizar vendas e subir as conversões, eles mudarão para ativo."
"Meus pixels estão inativos. O que posso fazer para ativá-los?"	"Quando você fizer vendas e subir as conversões, eles se tornarão ativos."
"Estou com os pixels em status inativo. O que devo fazer para ativá-los?"	"Assim que você realizar vendas e subir as conversões, eles mudarão para ativo."
"Meus pixels estão com status inativo. Como faço para ativá-los?"	"Assim que você tiver vendas e subir as conversões, eles se tornarão ativos."
"Os pixels que estou utilizando estão inativos. Como posso ativá-los?"	"Assim que você fizer vendas e atualizar as conversões, o status deles mudará para ativo."
"Estou vendo que meus pixels têm status inativo. Como posso deixá-los ativos?"	"Assim que você realizar vendas e subir as conversões, eles mudarão para ativo."
"Meus pixels estão inativos. O que fazer para torná-los ativos?"	"Quando você realizar vendas e subir as conversões, eles ficarão ativos."
"Os meus pixels estão com status inativo. Como faço para deixá-los ativos?"	"Assim que você fizer vendas e atualizar as conversões, eles mudarão para ativo."
"Estou tendo problemas com meus pixels inativos. O que devo fazer para ativá-los?"	"Assim que você tiver vendas e subir as conversões, o status deles mudará para ativo."
"Meus pixels estão inativos. Como posso ativá-los?"	"Depois que você realizar vendas e subir as conversões, eles se tornarão ativos."
"Você sabe por que o Gclid não apareceu na notificação?"	"Existem várias variáveis a considerar. É preciso rever as configurações para garantir que tudo esteja correto, e pode ser que tenha sido uma venda por cookie ou uma venda com IOS blindado, e nesse caso não dá para recuperar."
